{"applied_skills":[{"name":"review-code-change","sha256":"194eb62a12b70eb6efd922af05d797d4c0296efc8299ece3b9df5b156e8d6b9a","checks_completed":["Read SKILL.md and all linked references completely","Inventoried and reviewed all 42 tracked and untracked implementation files","Built the test matrix from AC1-AC22 and complete diff/impact analysis before assessing existing tests","Completed requirements, diff, architecture, behavior, tests, security, and regression passes","Verified current-cycle validation, provenance, freshness, and handoff evidence","Applied configured blocker/major verdict rules"]},{"name":"review-vertical-slice-completeness","sha256":"f79e84a3b87c748d30723b55856555a50a6e5d45a97afb4019350f2d98f73c1e","checks_completed":["Read SKILL.md and all linked references completely","Mapped AC1-AC22 to implementation and verification evidence","Reviewed API, CLI, worker, scheduler, realtime, context, security, observability, database, queue, and audit layers","Checked positive, negative, boundary, concurrency, transaction, security, compatibility, and regression coverage","Retested every prior Codex finding against current code and current-cycle evidence","Confirmed no required vertical-slice layer or applicable risk area remains unverified"]}],"task_id":"MEMORIES-0006","verdict":"pass","reviewed_repositories":["backend"],"review_coverage":{"review_passes":["requirements","diff","architecture","behavior","tests","security","regression"],"changed_files":[{"repo":"backend","file":".dependency-cruiser.js","status":"reviewed","evidence":"Reviewed complete diff; context library boundary and forbidden direct nestjs-cls imports are enforced and current architecture evidence reports 474 modules, 1,794 dependencies, zero violations."},{"repo":"backend","file":"apps/api/src/app.module.ts","status":"reviewed","evidence":"Reviewed complete diff and module graph; API installs one RuntimeContextModule root and preserves middleware ordering."},{"repo":"backend","file":"apps/cli/src/app.module.ts","status":"reviewed","evidence":"Reviewed complete diff and CLI runner dependencies; CLI installs the shared context root."},{"repo":"backend","file":"apps/realtime/src/app.module.ts","status":"reviewed","evidence":"Reviewed complete diff and gateway consumers; realtime installs the shared root without introducing an additional initializer."},{"repo":"backend","file":"apps/scheduler/src/app.module.ts","status":"reviewed","evidence":"Reviewed complete diff and scheduler consumers; scheduler installs the shared root and has no current context-dependent jobs requiring a new transport boundary."},{"repo":"backend","file":"apps/worker/src/app.module.ts","status":"reviewed","evidence":"Reviewed complete diff and BullMQ module flow; worker installs one shared context root."},{"repo":"backend","file":"apps/cli/test/cli-runner.audit-persistence.e2e-spec.ts","status":"reviewed","evidence":"Reviewed full untracked E2E test; it verifies SYSTEM_ACTOR_ID persistence, transactional commit/rollback, and cleanup."},{"repo":"backend","file":"apps/cli/test/cli-runner.service.spec.ts","status":"reviewed","evidence":"Reviewed full untracked unit test; it verifies CLI root creation, restoration, exception cleanup, and no redundant nested root."},{"repo":"backend","file":"libs/modules/card-catalog/src/application/use-cases/seed-card-templates.use-case.ts","status":"reviewed","evidence":"Reviewed complete diff; audit writes now consume the shared RequestContext actor with system fallback."},{"repo":"backend","file":"libs/modules/identity-access/src/application/use-cases/seed-roles-and-permissions.use-case.ts","status":"reviewed","evidence":"Reviewed complete diff; audit actor resolution uses shared context and preserves explicit system behavior."},{"repo":"backend","file":"libs/modules/identity-access/test/seed-roles-and-permissions.use-case.spec.ts","status":"reviewed","evidence":"Reviewed complete diff; tests cover ambient actor and SYSTEM_ACTOR_ID fallback."},{"repo":"backend","file":"libs/modules/product-catalog/src/application/use-cases/seed-products.use-case.ts","status":"reviewed","evidence":"Reviewed complete diff; audit writes use the shared request actor with system fallback."},{"repo":"backend","file":"libs/platform/context/src/index.ts","status":"reviewed","evidence":"Reviewed full public API; exports are limited to typed context abstractions and do not expose ClsService or raw storage."},{"repo":"backend","file":"libs/platform/context/src/runtime-context.accessor.ts","status":"reviewed","evidence":"Reviewed full source and callers; accessor exposes typed active/get/set operations without raw-store access."},{"repo":"backend","file":"libs/platform/context/src/runtime-context.module.ts","status":"reviewed","evidence":"Reviewed full source plus nestjs-cls implementation; root configuration uses one global ClsModule with safe middleware flags."},{"repo":"backend","file":"libs/platform/context/src/runtime-context.service.ts","status":"reviewed","evidence":"Reviewed full source and symbol flow; root/nested execution snapshots owned values, restores parents, rejects reused seeds, and avoids enterWith."},{"repo":"backend","file":"libs/platform/context/src/runtime-context.types.ts","status":"reviewed","evidence":"Reviewed all 595 lines; nominal keys, one-shot seeds, closed-world validation, pristine-prototype checks, and deep snapshots address prior aliasing and pollution defects."},{"repo":"backend","file":"libs/platform/context/test/runtime-context.service.spec.ts","status":"reviewed","evidence":"Reviewed all 59 test cases, including hostile seed graphs, nested isolation, concurrency, restoration, exception cleanup, and compile-time API restrictions."},{"repo":"backend","file":"libs/platform/context/tsconfig.lib.json","status":"reviewed","evidence":"Reviewed library build configuration and root project references."},{"repo":"backend","file":"libs/platform/database/src/typeorm-unit-of-work.ts","status":"reviewed","evidence":"Reviewed diff, full implementation, and CodeGraph impact across 35 QueryRunnerContext and 22 withTransaction callers."},{"repo":"backend","file":"libs/platform/database/test/typeorm-unit-of-work.spec.ts","status":"reviewed","evidence":"Reviewed complete diff; covers parentless, nested, reentrant, sibling, previous-runner restoration, concurrency, commit, rollback, and cleanup."},{"repo":"backend","file":"libs/platform/database/test/typeorm-unit-of-work-real-postgres.e2e-spec.ts","status":"reviewed","evidence":"Reviewed full E2E test; verifies real PostgreSQL commit/rollback and concurrent QueryRunner isolation."},{"repo":"backend","file":"libs/platform/observability/src/correlation-context.ts","status":"reviewed","evidence":"Reviewed complete diff and callers; correlation roots and nested scopes use the shared runtime service and consistent request/correlation resolution."},{"repo":"backend","file":"libs/platform/observability/src/correlation.middleware.ts","status":"reviewed","evidence":"Reviewed complete diff; middleware enriches the existing HTTP root rather than creating a second root."},{"repo":"backend","file":"libs/platform/observability/src/logger.module.ts","status":"reviewed","evidence":"Reviewed complete diff; logger uses shared request/correlation resolution and does not generate a divergent inactive-context request ID."},{"repo":"backend","file":"libs/platform/observability/test/correlation-context.spec.ts","status":"reviewed","evidence":"Reviewed complete expanded suite; covers header combinations, trace compatibility, nested/root isolation, parentless runs, errors, and concurrency."},{"repo":"backend","file":"libs/platform/observability/test/logger.module.spec.ts","status":"reviewed","evidence":"Reviewed complete expanded suite; covers inactive and active logging, duplicate-field prevention, identifier agreement, and concurrency."},{"repo":"backend","file":"libs/platform/queue/src/bullmq/bullmq.worker.ts","status":"reviewed","evidence":"Reviewed complete diff and CodeGraph worker flow; each job creates a correlation-only root and does not inherit HTTP actor or QueryRunner state."},{"repo":"backend","file":"libs/platform/queue/test/bullmq.publisher.spec.ts","status":"reviewed","evidence":"Reviewed complete diff; verifies explicit envelope actor metadata and correlation precedence without ambient actor leakage."},{"repo":"backend","file":"libs/platform/queue/test/bullmq.worker.correlation.spec.ts","status":"reviewed","evidence":"Reviewed complete expanded suite; verifies success/failure roots, metadata handling, actor isolation, concurrency, and cleanup."},{"repo":"backend","file":"libs/platform/queue/test/bullmq.worker.retries.spec.ts","status":"reviewed","evidence":"Reviewed complete diff; retry behavior retains correlation metadata without leaking context."},{"repo":"backend","file":"libs/platform/queue/test/bullmq-real-redis-isolation.e2e-spec.ts","status":"reviewed","evidence":"Reviewed full E2E test; verifies real Redis/BullMQ success, failure, concurrent isolation, and cleanup using actual context accessors."},{"repo":"backend","file":"libs/platform/security/src/request-context.middleware.ts","status":"reviewed","evidence":"Reviewed complete diff and middleware chain; request context enriches the single HTTP root."},{"repo":"backend","file":"libs/platform/security/src/request-context.ts","status":"reviewed","evidence":"Reviewed complete diff; actor, roles, permissions, requestedAt, requestId, and correlationId are snapshotted and restored safely."},{"repo":"backend","file":"libs/platform/security/test/http-context-lifecycle.e2e-spec.ts","status":"reviewed","evidence":"Reviewed full E2E suite; covers anonymous/authenticated concurrent requests, permissions, identifiers, real transactions, error rollback, and cleanup."},{"repo":"backend","file":"libs/platform/security/test/jwt-auth.guard.spec.ts","status":"reviewed","evidence":"Reviewed complete diff; JWT enrichment remains in the existing root and propagate